{
  "schema": "systems_hub.run_receipt/v1",
  "run_id": "2026-06-15T15-34-16-063Z-weekly-business-review",
  "task_id": "weekly-business-review",
  "task_kind": "standard",
  "started_at": "2026-06-15T15:32:53.427Z",
  "finished_at": "2026-06-15T15:34:16.063Z",
  "provider": "deepseek",
  "model": "deepseek-v4-flash",
  "contract": {
    "manifest_sha256": "137ff5cf5e9b2693b012ce9180163d613a3ba31c5493053b6ab8e386825aba22",
    "prompt_sha256": "8a32e74465d96f71b21479a14ff7400981af433f91e66a9bc7ad64c716fc762b",
    "ephemeral_manifest": true,
    "manifest_path": "operations/runs/usage/2026/06/2026-06-15T15-34-16-063Z-weekly-business-review.manifest.json"
  },
  "context": {
    "files": [
      "agents/roles/chief-of-staff-business.md",
      "operations/jobs/weekly-business-review.md",
      "company/strategy/overview.md",
      "company/strategy/current-priorities.md",
      "company/okrs/2026-q2.md",
      "company/portfolio/status.md",
      "company/operations/risk-register.md",
      "operations/decisions/log.md",
      "projects/traders-hub/reports/current-status.md",
      "projects/traders-hub/reports/launch-scoreboard.md"
    ],
    "file_count": 10,
    "total_bytes": 13339
  },
  "usage": {
    "input": 1298,
    "output": 1505,
    "cache_read": 10496,
    "cache_write": 0,
    "total_tokens": 13299,
    "cost_usd": 0.0006325088000000001
  },
  "output": {
    "path": "operations/runs/usage/2026/06/2026-06-15T15-34-16-063Z-weekly-business-review.md",
    "sha256": "099dfeffcddb96a0a5b07fcca3fc6b735468688c8018edbe322250c71fc9fc8c",
    "word_count": 865
  },
  "validation": {
    "status": "pass",
    "checks": [
      "output words: 865/900",
      "output starts with: ## Scoreboard",
      "required section: Scoreboard",
      "required section: Project Status",
      "required section: What Moved",
      "required section: What Is Stuck",
      "required section: Top Three Priorities",
      "required section: Decisions Needed",
      "required section: Evidence Quality",
      "section pattern present (Top Three Priorities): launch-proof gaps",
      "section pattern present (Top Three Priorities): decision-grade business evidence",
      "section pattern present (Top Three Priorities): measured distribution",
      "section pattern present (Decisions Needed): Option 1:",
      "section pattern present (Decisions Needed): Option 2:",
      "section pattern present (Decisions Needed): - What it does:",
      "section pattern present (Decisions Needed): - Trade-off:",
      "section pattern present (Decisions Needed): → Recommendation:",
      "forbidden pattern absent: \\bSystems Hub(?: LLC)? is (?:currently )?a single[- ]product company\\b",
      "forbidden pattern absent: \\blaunch is complete\\b",
      "forbidden pattern absent: \\bprofitable trading\\b",
      "forbidden pattern absent: ^Now I",
      "forbidden pattern absent: ^Here is",
      "forbidden pattern absent: \\b(?:this|that) is the only path\\b",
      "forbidden pattern absent: \\bzero verified active beta testers\\b",
      "required pattern present: Trader's Hub",
      "required pattern present: unknown|evidence",
      "evidence language present",
      "input tokens: 1298/18000",
      "output tokens: 1505/2600",
      "total tokens: 13299/26000",
      "cost USD: 0.0006325088000000001/0.15"
    ],
    "failures": []
  },
  "promotion": {
    "eligible": true,
    "human_review_required": true
  }
}
